{
  "event_type": "monitoring_event",
  "source": "diun",
  "severity": "info",
  "title": "Docker image update: nginx/nginx",
  "message": "Docker image update: nginx/nginx (status: new). Hub: https://hub.docker.com/r/nginx/nginx",
  "data": {
    "image": "nginx/nginx",
    "status": "new",
    "hub_link": "https://hub.docker.com/r/nginx/nginx"
  }
}
